[{"id":"us-abc","name":"ABC","shortName":"ABC","aliases":[],"country":"US","languages":["eng"],"categories":["general","entertainment"],"network":"ABC","website":"https://abc.com/","logo":null,"epgIds":[],"enabled":true,"isAdult":false,"sortOrder":10,"tags":[],"access":{"model":"free-to-air","providerIds":[],"packageIds":[]}},{"id":"us-cbs","name":"CBS","shortName":"CBS","aliases":[],"country":"US","languages":["eng"],"categories":["general","entertainment"],"network":"CBS","website":"https://www.cbs.com/","logo":null,"epgIds":[],"enabled":true,"isAdult":false,"sortOrder":20,"tags":[],"access":{"model":"free-to-air","providerIds":[],"packageIds":[]}},{"id":"us-nbc","name":"NBC","shortName":"NBC","aliases":[],"country":"US","languages":["eng"],"categories":["general","entertainment"],"network":"NBC","website":"https://www.nbc.com/","logo":null,"epgIds":[],"enabled":true,"isAdult":false,"sortOrder":30,"tags":[],"access":{"model":"free-to-air","providerIds":[],"packageIds":[]}},{"id":"us-fox","name":"FOX","shortName":"FOX","aliases":[],"country":"US","languages":["eng"],"categories":["general","entertainment"],"network":"Fox","website":"https://www.fox.com/","logo":null,"epgIds":[],"enabled":true,"isAdult":false,"sortOrder":40,"tags":[],"access":{"model":"free-to-air","providerIds":[],"packageIds":[]}},{"id":"us-pbs","name":"PBS","shortName":"PBS","aliases":[],"country":"US","languages":["eng"],"categories":["public","education"],"network":"PBS","website":"https://www.pbs.org/","logo":null,"epgIds":[],"enabled":true,"isAdult":false,"sortOrder":50,"tags":[],"access":{"model":"free-to-air","providerIds":[],"packageIds":[]}},{"id":"us-cnn","name":"CNN","shortName":"CNN","aliases":[],"country":"US","languages":["eng"],"categories":["news"],"network":"CNN","website":"https://www.cnn.com/","logo":null,"epgIds":[],"enabled":true,"isAdult":false,"sortOrder":60,"tags":[],"access":{"model":"free-to-air","providerIds":[],"packageIds":[]}},{"id":"us-ms-now","name":"MS NOW","shortName":"MS NOW","aliases":["MSNBC"],"country":"US","languages":["eng"],"categories":["news"],"network":null,"website":"https://www.msnow.com/","logo":null,"epgIds":[],"enabled":true,"isAdult":false,"sortOrder":70,"tags":[],"access":{"model":"free-to-air","providerIds":[],"packageIds":[]}},{"id":"us-fox-news","name":"Fox News","shortName":"Fox News","aliases":[],"country":"US","languages":["eng"],"categories":["news"],"network":"Fox News Media","website":"https://www.foxnews.com/","logo":null,"epgIds":[],"enabled":true,"isAdult":false,"sortOrder":80,"tags":[],"access":{"model":"free-to-air","providerIds":[],"packageIds":[]}},{"id":"us-cnbc","name":"CNBC","shortName":"CNBC","aliases":[],"country":"US","languages":["eng"],"categories":["business","news"],"network":"NBCUniversal","website":"https://www.cnbc.com/","logo":null,"epgIds":[],"enabled":true,"isAdult":false,"sortOrder":90,"tags":[],"access":{"model":"free-to-air","providerIds":[],"packageIds":[]}},{"id":"us-bloomberg-tv","name":"Bloomberg Television","shortName":"Bloomberg Television","aliases":[],"country":"US","languages":["eng"],"categories":["business","news"],"network":"Bloomberg","website":"https://www.bloomberg.com/live","logo":null,"epgIds":[],"enabled":true,"isAdult":false,"sortOrder":100,"tags":[],"access":{"model":"free-to-air","providerIds":[],"packageIds":[]}},{"id":"us-pbs-kids","name":"PBS KIDS","shortName":"PBS KIDS","aliases":[],"country":"US","languages":["eng"],"categories":["kids","education"],"network":"PBS","website":"https://pbskids.org/","logo":null,"epgIds":[],"enabled":true,"isAdult":false,"sortOrder":110,"tags":[],"access":{"model":"free-to-air","providerIds":[],"packageIds":[]}}]
