[{"id":"tr-trt-1","name":"TRT 1","shortName":"TRT 1","aliases":[],"country":"TR","languages":["tur"],"categories":["general","entertainment"],"network":"TRT","website":"https://www.trt1.com.tr/","logo":null,"epgIds":[],"enabled":true,"isAdult":false,"sortOrder":10,"tags":[],"access":{"model":"free-to-air","providerIds":[],"packageIds":[]}},{"id":"tr-atv","name":"atv","shortName":"atv","aliases":[],"country":"TR","languages":["tur"],"categories":["general","entertainment"],"network":"Turkuvaz Media Group","website":"https://www.atv.com.tr/","logo":null,"epgIds":[],"enabled":true,"isAdult":false,"sortOrder":20,"tags":[],"access":{"model":"free-to-air","providerIds":[],"packageIds":[]}},{"id":"tr-kanal-d","name":"Kanal D","shortName":"Kanal D","aliases":[],"country":"TR","languages":["tur"],"categories":["general","entertainment"],"network":"Demirören Media","website":"https://www.kanald.com.tr/","logo":null,"epgIds":[],"enabled":true,"isAdult":false,"sortOrder":30,"tags":[],"access":{"model":"free-to-air","providerIds":[],"packageIds":[]}},{"id":"tr-show-tv","name":"Show TV","shortName":"Show TV","aliases":[],"country":"TR","languages":["tur"],"categories":["general","entertainment"],"network":null,"website":"https://www.showtv.com.tr/","logo":null,"epgIds":[],"enabled":true,"isAdult":false,"sortOrder":40,"tags":[],"access":{"model":"free-to-air","providerIds":[],"packageIds":[]}},{"id":"tr-star-tv","name":"Star TV","shortName":"Star TV","aliases":[],"country":"TR","languages":["tur"],"categories":["general","entertainment"],"network":null,"website":"https://www.startv.com.tr/","logo":null,"epgIds":[],"enabled":true,"isAdult":false,"sortOrder":50,"tags":[],"access":{"model":"free-to-air","providerIds":[],"packageIds":[]}},{"id":"tr-now","name":"NOW","shortName":"NOW","aliases":["FOX"],"country":"TR","languages":["tur"],"categories":["general","entertainment"],"network":null,"website":"https://www.nowtv.com.tr/","logo":null,"epgIds":[],"enabled":true,"isAdult":false,"sortOrder":60,"tags":[],"access":{"model":"free-to-air","providerIds":[],"packageIds":[]}},{"id":"tr-tv8","name":"TV8","shortName":"TV8","aliases":[],"country":"TR","languages":["tur"],"categories":["entertainment"],"network":null,"website":"https://www.tv8.com.tr/","logo":null,"epgIds":[],"enabled":true,"isAdult":false,"sortOrder":70,"tags":[],"access":{"model":"free-to-air","providerIds":[],"packageIds":[]}},{"id":"tr-trt-haber","name":"TRT Haber","shortName":"TRT Haber","aliases":[],"country":"TR","languages":["tur"],"categories":["news"],"network":"TRT","website":"https://www.trthaber.com/","logo":null,"epgIds":[],"enabled":true,"isAdult":false,"sortOrder":80,"tags":[],"access":{"model":"free-to-air","providerIds":[],"packageIds":[]}},{"id":"tr-ntv","name":"NTV","shortName":"NTV","aliases":[],"country":"TR","languages":["tur"],"categories":["news"],"network":null,"website":"https://www.ntv.com.tr/","logo":null,"epgIds":[],"enabled":true,"isAdult":false,"sortOrder":90,"tags":[],"access":{"model":"free-to-air","providerIds":[],"packageIds":[]}},{"id":"tr-cnn-turk","name":"CNN Türk","shortName":"CNN Türk","aliases":[],"country":"TR","languages":["tur"],"categories":["news"],"network":"Demirören Media","website":"https://www.cnnturk.com/","logo":null,"epgIds":[],"enabled":true,"isAdult":false,"sortOrder":100,"tags":[],"access":{"model":"free-to-air","providerIds":[],"packageIds":[]}},{"id":"tr-haberturk","name":"Habertürk TV","shortName":"Habertürk TV","aliases":[],"country":"TR","languages":["tur"],"categories":["news"],"network":null,"website":"https://www.haberturk.com/","logo":null,"epgIds":[],"enabled":true,"isAdult":false,"sortOrder":110,"tags":[],"access":{"model":"free-to-air","providerIds":[],"packageIds":[]}},{"id":"tr-a-haber","name":"A Haber","shortName":"A Haber","aliases":[],"country":"TR","languages":["tur"],"categories":["news"],"network":null,"website":"https://www.ahaber.com.tr/","logo":null,"epgIds":[],"enabled":true,"isAdult":false,"sortOrder":120,"tags":[],"access":{"model":"free-to-air","providerIds":[],"packageIds":[]}},{"id":"tr-trt-spor","name":"TRT Spor","shortName":"TRT Spor","aliases":[],"country":"TR","languages":["tur"],"categories":["sports"],"network":"TRT","website":"https://www.trtspor.com.tr/","logo":null,"epgIds":[],"enabled":true,"isAdult":false,"sortOrder":130,"tags":[],"access":{"model":"free-to-air","providerIds":[],"packageIds":[]}},{"id":"tr-trt-cocuk","name":"TRT Çocuk","shortName":"TRT Çocuk","aliases":[],"country":"TR","languages":["tur"],"categories":["kids"],"network":"TRT","website":"https://www.trtcocuk.net.tr/","logo":null,"epgIds":[],"enabled":true,"isAdult":false,"sortOrder":140,"tags":[],"access":{"model":"free-to-air","providerIds":[],"packageIds":[]}},{"id":"tr-kanal-7","name":"Kanal 7","shortName":"Kanal 7","aliases":[],"country":"TR","languages":["tur"],"categories":["general"],"network":null,"website":"https://www.kanal7.com/","logo":null,"epgIds":[],"enabled":true,"isAdult":false,"sortOrder":150,"tags":[],"access":{"model":"free-to-air","providerIds":[],"packageIds":[]}}]
